[
  {
    "id": "math-number-001",
    "subject": "maths",
    "topic": "number",
    "prompt": "Which number is largest?",
    "options": ["0.6", "0.55", "0.611", "0.5"],
    "answer": 2,
    "explainer": "Compare digit by digit after the point. 0.611 has 6, 1, 1; 0.6 only has 6 — so 0.611 wins."
  },
  {
    "id": "math-number-002",
    "subject": "maths",
    "topic": "number",
    "prompt": "Round 6.483 to 1 decimal place.",
    "options": ["6.4", "6.48", "6.5", "6.50"],
    "answer": 2,
    "explainer": "The digit after the first decimal is 8, so round up. 6.483 → 6.5."
  },
  {
    "id": "math-number-003",
    "subject": "maths",
    "topic": "number",
    "prompt": "Round 247 to the nearest 10.",
    "options": ["240", "245", "250", "300"],
    "answer": 2,
    "explainer": "The units digit is 7 (5 or more), so round up to 250."
  },
  {
    "id": "math-number-004",
    "subject": "maths",
    "topic": "number",
    "prompt": "What is the square root of 144?",
    "options": ["10", "11", "12", "14"],
    "answer": 2,
    "explainer": "12 × 12 = 144, so √144 = 12."
  },
  {
    "id": "math-number-005",
    "subject": "maths",
    "topic": "number",
    "prompt": "What is 3² − 2³?",
    "options": ["0", "1", "5", "13"],
    "answer": 1,
    "explainer": "3² = 9, 2³ = 8, so 9 − 8 = 1."
  },
  {
    "id": "math-fractions-001",
    "subject": "maths",
    "topic": "fractions",
    "prompt": "What is 3/4 as a decimal?",
    "options": ["0.34", "0.7", "0.75", "0.34/4"],
    "answer": 2,
    "explainer": "3 ÷ 4 = 0.75. Memorise 1/4 = 0.25, 1/2 = 0.5, 3/4 = 0.75."
  },
  {
    "id": "math-fractions-002",
    "subject": "maths",
    "topic": "fractions",
    "prompt": "1/2 + 1/3 = ?",
    "options": ["2/5", "1/6", "5/6", "1/3"],
    "answer": 2,
    "explainer": "Common denominator 6: 1/2 = 3/6, 1/3 = 2/6, so 3/6 + 2/6 = 5/6."
  },
  {
    "id": "math-fractions-003",
    "subject": "maths",
    "topic": "fractions",
    "prompt": "What is 2/5 of 50?",
    "options": ["10", "15", "20", "25"],
    "answer": 2,
    "explainer": "1/5 of 50 is 10, so 2/5 of 50 is 20."
  },
  {
    "id": "math-fractions-004",
    "subject": "maths",
    "topic": "fractions",
    "prompt": "Simplify 12/18.",
    "options": ["2/3", "3/4", "6/9", "1/2"],
    "answer": 0,
    "explainer": "Divide top and bottom by 6: 12/18 = 2/3."
  },
  {
    "id": "math-decimals-001",
    "subject": "maths",
    "topic": "decimals",
    "prompt": "0.4 × 100 = ?",
    "options": ["4", "40", "400", "0.04"],
    "answer": 1,
    "explainer": "Multiplying by 100 moves the decimal point two places to the right. 0.4 → 40."
  },
  {
    "id": "math-decimals-002",
    "subject": "maths",
    "topic": "decimals",
    "prompt": "Convert 0.25 to a fraction in its simplest form.",
    "options": ["25/100", "1/4", "2/5", "1/2"],
    "answer": 1,
    "explainer": "0.25 = 25/100 = 1/4 once you divide top and bottom by 25."
  },
  {
    "id": "math-percentages-001",
    "subject": "maths",
    "topic": "percentages",
    "prompt": "What is 25% of 80?",
    "options": ["8", "16", "20", "25"],
    "answer": 2,
    "explainer": "25% is 1/4. 80 ÷ 4 = 20."
  },
  {
    "id": "math-percentages-002",
    "subject": "maths",
    "topic": "percentages",
    "prompt": "Convert 1/2 to a percentage.",
    "options": ["20%", "25%", "50%", "75%"],
    "answer": 2,
    "explainer": "1/2 means 50 out of every 100, so 50%."
  },
  {
    "id": "math-percentages-003",
    "subject": "maths",
    "topic": "percentages",
    "prompt": "A jacket is £40 with 10% off. What is the sale price?",
    "options": ["£30", "£36", "£38", "£44"],
    "answer": 1,
    "explainer": "10% of £40 is £4. £40 − £4 = £36."
  },
  {
    "id": "math-ratio-001",
    "subject": "maths",
    "topic": "ratio",
    "prompt": "Write 12 : 8 in its simplest form.",
    "options": ["6 : 4", "3 : 2", "4 : 3", "1 : 2"],
    "answer": 1,
    "explainer": "Divide both sides by 4 (the highest common factor): 12 : 8 = 3 : 2."
  },
  {
    "id": "math-ratio-002",
    "subject": "maths",
    "topic": "ratio",
    "prompt": "Share £30 in the ratio 2 : 3. What is the larger share?",
    "options": ["£10", "£12", "£15", "£18"],
    "answer": 3,
    "explainer": "Total parts = 5. Each part = £6. Larger share = 3 × £6 = £18."
  },
  {
    "id": "math-negatives-001",
    "subject": "maths",
    "topic": "negatives",
    "prompt": "−7 + 4 = ?",
    "options": ["−11", "−4", "−3", "3"],
    "answer": 2,
    "explainer": "Start at −7, count up 4: −7 → −6 → −5 → −4 → −3."
  },
  {
    "id": "math-negatives-002",
    "subject": "maths",
    "topic": "negatives",
    "prompt": "−5 × −3 = ?",
    "options": ["−15", "−8", "8", "15"],
    "answer": 3,
    "explainer": "A negative times a negative is a positive. 5 × 3 = 15."
  },
  {
    "id": "math-negatives-003",
    "subject": "maths",
    "topic": "negatives",
    "prompt": "What is −12 ÷ 4?",
    "options": ["−3", "3", "−16", "−48"],
    "answer": 0,
    "explainer": "A negative divided by a positive gives a negative. 12 ÷ 4 = 3, so the answer is −3."
  },
  {
    "id": "math-algebra-001",
    "subject": "maths",
    "topic": "algebra",
    "prompt": "If y = 3x + 2 and x = 4, what is y?",
    "options": ["10", "12", "14", "18"],
    "answer": 2,
    "explainer": "Replace x with 4: y = 3 × 4 + 2 = 12 + 2 = 14."
  },
  {
    "id": "math-algebra-002",
    "subject": "maths",
    "topic": "algebra",
    "prompt": "Solve 2x + 5 = 13.",
    "options": ["x = 3", "x = 4", "x = 6", "x = 9"],
    "answer": 1,
    "explainer": "Subtract 5: 2x = 8. Divide by 2: x = 4."
  },
  {
    "id": "math-algebra-003",
    "subject": "maths",
    "topic": "algebra",
    "prompt": "Simplify 4a + 3a − 2a.",
    "options": ["a", "2a", "5a", "9a"],
    "answer": 2,
    "explainer": "Combine like terms: 4 + 3 − 2 = 5, so the answer is 5a."
  },
  {
    "id": "math-algebra-004",
    "subject": "maths",
    "topic": "algebra",
    "prompt": "Factorise 6x + 9.",
    "options": ["3(2x + 3)", "6(x + 3)", "x(6 + 9)", "Cannot be factorised"],
    "answer": 0,
    "explainer": "The highest factor of 6 and 9 is 3. 6x ÷ 3 = 2x; 9 ÷ 3 = 3. So 6x + 9 = 3(2x + 3)."
  },
  {
    "id": "math-sequences-001",
    "subject": "maths",
    "topic": "sequences",
    "prompt": "A sequence starts at 3 and each term goes up by 4. What is the 5th term?",
    "options": ["15", "19", "20", "23"],
    "answer": 1,
    "explainer": "Terms are 3, 7, 11, 15, 19. The 5th term is 19."
  },
  {
    "id": "math-sequences-002",
    "subject": "maths",
    "topic": "sequences",
    "prompt": "What is the next term: 2, 4, 8, 16, ...?",
    "options": ["20", "24", "32", "64"],
    "answer": 2,
    "explainer": "Each term doubles. 16 × 2 = 32."
  },
  {
    "id": "math-geometry-001",
    "subject": "maths",
    "topic": "geometry",
    "prompt": "The angles in a triangle add to:",
    "options": ["90°", "180°", "270°", "360°"],
    "answer": 1,
    "explainer": "Always 180° in any triangle. If you know two angles, you can find the third."
  },
  {
    "id": "math-geometry-002",
    "subject": "maths",
    "topic": "geometry",
    "prompt": "Angles on a straight line add to:",
    "options": ["90°", "180°", "270°", "360°"],
    "answer": 1,
    "explainer": "A straight line is half a full turn — that's 180°."
  },
  {
    "id": "math-geometry-003",
    "subject": "maths",
    "topic": "geometry",
    "prompt": "Angles around a point add to:",
    "options": ["90°", "180°", "270°", "360°"],
    "answer": 3,
    "explainer": "A full turn is 360°."
  },
  {
    "id": "math-geometry-004",
    "subject": "maths",
    "topic": "geometry",
    "prompt": "Area of a rectangle with width 5 cm and length 8 cm.",
    "options": ["13 cm²", "26 cm²", "40 cm²", "80 cm²"],
    "answer": 2,
    "explainer": "Area = length × width = 8 × 5 = 40 cm²."
  },
  {
    "id": "math-geometry-005",
    "subject": "maths",
    "topic": "geometry",
    "prompt": "Perimeter of a square with side 7 cm.",
    "options": ["14 cm", "21 cm", "28 cm", "49 cm"],
    "answer": 2,
    "explainer": "All four sides are equal: 4 × 7 = 28 cm."
  },
  {
    "id": "math-statistics-001",
    "subject": "maths",
    "topic": "statistics",
    "prompt": "Find the mean of 4, 6, 8, 10.",
    "options": ["6", "7", "7.5", "8"],
    "answer": 1,
    "explainer": "Add: 4 + 6 + 8 + 10 = 28. Divide by 4: mean = 7."
  },
  {
    "id": "math-statistics-002",
    "subject": "maths",
    "topic": "statistics",
    "prompt": "Find the median of 3, 7, 9, 12, 15.",
    "options": ["7", "9", "9.5", "12"],
    "answer": 1,
    "explainer": "Already in order. Five numbers — the middle one is the third: 9."
  },
  {
    "id": "math-statistics-003",
    "subject": "maths",
    "topic": "statistics",
    "prompt": "Find the mode of 3, 5, 5, 7, 9.",
    "options": ["3", "5", "7", "29"],
    "answer": 1,
    "explainer": "The mode is the most common value. 5 appears twice; the others appear once."
  },
  {
    "id": "math-statistics-004",
    "subject": "maths",
    "topic": "statistics",
    "prompt": "Find the range of 12, 18, 23, 9, 15.",
    "options": ["9", "14", "15", "23"],
    "answer": 1,
    "explainer": "Range = largest − smallest = 23 − 9 = 14."
  },
  {
    "id": "math-probability-001",
    "subject": "maths",
    "topic": "probability",
    "prompt": "What is the probability of rolling a 4 on a fair six-sided die?",
    "options": ["1/4", "1/6", "4/6", "1/2"],
    "answer": 1,
    "explainer": "There's one 4 out of six equally likely outcomes, so 1/6."
  },
  {
    "id": "math-functions-001",
    "subject": "maths",
    "topic": "function-machines",
    "visual": "function-machine",
    "prompt": "A function machine does \"+5\" then \"×2\". What does it output for input 3?",
    "options": ["8", "11", "16", "13"],
    "answer": 2,
    "explainer": "Input 3, then +5 = 8, then ×2 = 16. Order matters — do the steps left to right."
  },
  {
    "id": "math-functions-002",
    "subject": "maths",